<?xml version="1.0"?>
<!DOCTYPE chapter SYSTEM "chapter.dtd">
<chapter>
<title>XML programming</title>
<content>
<paragraphs>
<index>18</index>
</paragraphs>
<poems>
<line>its linux</line>
<line>linux shell script</line>
</poems>
</content>
<chapterno>1</chapterno>
</chapter>

